{
  "$schema": "https://json-schema.org/draft/2020-12/schema",
  "$id": "https://generic-harness/schemas/run-manifest/v0",
  "title": "Manifesto de run v0",
  "description": "Evidência de uma tentativa do gate (HG §3.7, contrato mínimo de evidência). Gravado por `harness gate` em .harness/runs/<runId>/manifest.json. `task done` só aceita um manifesto cujo `inputs.tree` seja igual ao hash da árvore atual e cujo `result` seja `pass`.",
  "type": "object",
  "required": ["schema", "runId", "attempt", "taskId", "startedAt", "finishedAt", "result", "inputs", "environment", "checks"],
  "additionalProperties": false,
  "properties": {
    "schema": { "const": 0 },
    "runId": { "type": "string", "pattern": "^[0-9]{8}T[0-9]{6}Z-[0-9a-f]{6}$", "description": "UTC + sufixo aleatório, ex.: 20261030T141500Z-a1b2c3" },
    "attempt": { "type": "integer", "minimum": 1, "description": "Número da tentativa para esta task." },
    "taskId": { "type": "string", "pattern": "^([A-Z][A-Z0-9]*-\\d+\\.)?T\\d+$" },
    "workId": { "type": "string", "pattern": "^[A-Z][A-Z0-9]*-\\d+$" },
    "requirements": { "type": "array", "items": { "type": "string" } },
    "mode": { "enum": ["gate", "prove-sensor"], "default": "gate" },
    "startedAt": { "$ref": "#/$defs/timestamp" },
    "finishedAt": { "$ref": "#/$defs/timestamp" },
    "result": {
      "description": "pass só quando todos os checks exigidos passaram. sensor-absent quando algum comando exigido está `planned` ou indisponível (GF §4.2).",
      "enum": ["pass", "fail", "sensor-absent", "error"]
    },
    "inputs": {
      "type": "object",
      "required": ["revision", "dirty", "tree", "treeAlgorithm", "treeExcludes", "profileSha256", "harnessVersion"],
      "additionalProperties": false,
      "properties": {
        "revision": { "type": ["string", "null"], "pattern": "^[0-9a-f]{40}$", "description": "HEAD; null em repo sem commits." },
        "dirty": { "type": "boolean", "description": "Havia mudanças não comitadas incluídas no hash." },
        "tree": { "type": "string", "pattern": "^[0-9a-f]{64}$", "description": "Hash da árvore de trabalho, incluindo mudanças não comitadas e arquivos não rastreados não ignorados." },
        "treeAlgorithm": { "const": "sha256-worktree-v0" },
        "treeExcludes": { "type": "array", "items": { "type": "string" }, "description": "Caminhos excluídos do hash por serem gerados pelo próprio harness (ex.: .harness/runs/**)." },
        "profileSha256": { "$ref": "#/$defs/sha256" },
        "harnessVersion": { "type": "string", "minLength": 1 },
        "harnessLockSha256": { "$ref": "#/$defs/sha256" },
        "adapter": { "type": "string" },
        "testsSha256": { "$ref": "#/$defs/sha256", "description": "Hash dos testes congelados (fase 1, S3)." },
        "baselineSha256": { "$ref": "#/$defs/sha256" }
      }
    },
    "environment": {
      "type": "object",
      "required": ["os", "python"],
      "additionalProperties": false,
      "properties": {
        "os": { "enum": ["linux", "darwin", "windows", "other"] },
        "python": { "type": "string" },
        "ci": { "type": "boolean" },
        "host": { "type": "string" }
      }
    },
    "checks": {
      "type": "array",
      "minItems": 1,
      "items": { "$ref": "#/$defs/check" }
    },
    "supersedes": { "type": "string", "description": "runId da tentativa anterior desta task." }
  },
  "$defs": {
    "timestamp": { "type": "string", "pattern": "^\\d{4}-\\d{2}-\\d{2}T\\d{2}:\\d{2}:\\d{2}(\\.\\d+)?Z$" },
    "sha256": { "type": "string", "pattern": "^[0-9a-f]{64}$" },
    "artifact": {
      "type": "object",
      "required": ["path", "sha256"],
      "additionalProperties": false,
      "properties": {
        "path": { "type": "string", "minLength": 1 },
        "sha256": { "$ref": "#/$defs/sha256" }
      }
    },
    "check": {
      "type": "object",
      "required": ["name", "status"],
      "additionalProperties": false,
      "properties": {
        "name": { "type": "string", "pattern": "^[a-z][a-z0-9-]*(\\.[a-z][a-z0-9-]*)?$", "description": "Nome do comando no perfil, ex.: test.unit" },
        "status": { "enum": ["pass", "fail", "absent", "unavailable", "error", "skipped"] },
        "run": { "type": "string" },
        "exitCode": { "type": ["integer", "null"] },
        "startedAt": { "$ref": "#/$defs/timestamp" },
        "finishedAt": { "$ref": "#/$defs/timestamp" },
        "durationMs": { "type": "integer", "minimum": 0 },
        "log": { "$ref": "#/$defs/artifact" },
        "report": {
          "type": "object",
          "required": ["path", "sha256", "tests", "failures", "errors", "skipped"],
          "additionalProperties": false,
          "properties": {
            "path": { "type": "string" },
            "sha256": { "$ref": "#/$defs/sha256" },
            "mtimeAfterStart": { "type": "boolean", "description": "O relatório foi escrito durante esta tentativa (recusa relatório antigo)." },
            "tests": { "type": "integer", "minimum": 0 },
            "failures": { "type": "integer", "minimum": 0 },
            "errors": { "type": "integer", "minimum": 0 },
            "skipped": { "type": "integer", "minimum": 0 },
            "firstFailures": {
              "type": "array",
              "maxItems": 10,
              "items": {
                "type": "object",
                "required": ["location", "name"],
                "additionalProperties": false,
                "properties": {
                  "location": { "type": "string", "description": "arquivo:linha" },
                  "name": { "type": "string" }
                }
              }
            }
          }
        },
        "absent": {
          "type": "object",
          "description": "Por que o sensor não existe ainda, para o agente não improvisar outro comando (GF §4.2, P15).",
          "required": ["reason"],
          "additionalProperties": false,
          "properties": {
            "reason": { "enum": ["planned", "not-in-profile", "not-approved", "tool-missing"] },
            "decidedBy": { "type": "string", "pattern": "^ADR-\\d{4}$" },
            "createdBy": { "type": "string", "description": "Task que vai criar o sensor, ex.: GEN-001" }
          }
        }
      },
      "allOf": [
        { "if": { "properties": { "status": { "enum": ["pass", "fail"] } } }, "then": { "required": ["run", "exitCode", "log"] } },
        { "if": { "properties": { "status": { "const": "absent" } } }, "then": { "required": ["absent"] } }
      ]
    }
  }
}
